Table,VariableName,Definition,Label/Description,Type,Unit/Format,AllowedValues/Range,MissingValue(s),Derivation/Formula,RelationTo,Example,Source/Provenance,QA/Validation,Notes
bsm_parquet,mf_bytes,"
Raw binary payload of a single SAE J2735 Basic Safety Message (BSM), stored as a byte sequence before decoding.",Raw BSM payload bytes (binary frame),binary,raw bytes,>0 length,none,Captured frame payload,MessageType; Latitude; Longitude; Geohash,length=235 bytes,DriveAZ-IOS App to DRIVEAZ-MSGROUTER to Cyverse,len>0; consistent length across records,Decode with libsm decodeToJER for structured sub-fields
bsm_parquet,TimeStamp,"Ingestion time of the BSM at the server, in Unix epoch seconds (UTC), representing when the message was logged.",Event timestamp (Unix epoch seconds UTC),float,epoch seconds,>1.5e9,none,Ingest server clock,,1756415644.563510,DriveAZ-IOS App to DRIVEAZ-MSGROUTER to Cyverse,numeric; monotonic within session,Convert to ISO-8601 for presentation
bsm_parquet,MessageType,Text label of the SAE J2735 message type decoded from the frame header (here: “BasicSafetyMessage”).,SAE J2735 message type,string,,{BasicSafetyMessage},none,Frame header decode,,BasicSafetyMessage,DriveAZ-IOS App to DRIVEAZ-MSGROUTER to Cyverse,value in enum,Expect {BasicSafetyMessage}; flag out-of-set
bsm_parquet,Geohash,"Base32 geohash string derived from latitude and longitude, used as a coarse spatial index for the BSM location.",Geospatial geohash (dataset sample),string,base32,length 5..12; charset A-Z2-7,none,"Encode(Latitude,Longitude)",Latitude; Longitude,9t9p75y,DriveAZ-IOS App to DRIVEAZ-MSGROUTER to Cyverse,length 5..12; matches lat/long bbox,Spatial index for coarse grouping
bsm_parquet,Latitude,"
Vehicle latitude in WGS84 decimal degrees (−90 to +90), decoded from the BSM payload at transmission time.",Vehicle latitude (WGS84),float,decimal degrees,"[-90,90]",none,Decoded from payload,Longitude; Geohash,33.4484,DriveAZ-IOS App to DRIVEAZ-MSGROUTER to Cyverse,-90<=val<=90,Use with Longitude for positioning
bsm_parquet,Longitude,"Vehicle longitude in WGS84 decimal degrees (−180 to +180), decoded from the BSM payload at transmission time.",Vehicle longitude (WGS84),float,decimal degrees,"[-180,180]",none,Decoded from payload,Latitude; Geohash,-112.0740,DriveAZ-IOS App to DRIVEAZ-MSGROUTER to Cyverse,-180<=val<=180,Use with Latitude for positioning